{"approvedInputSha256":"9341f2b4567440b310a4d494f5cc5599ca334ba51c8042247317ff466492f2e9","check":{"id":"protocol-0x0135-single-direct-caller-v1","version":1},"publicRepositoryCommit":"0c5d393638a6ce18eb9ba717ac4e97231d36afda","result":{"status":"pass"},"schemaVersion":1,"toolVersions":{"ghidra":"12.1.3","jdk":"21.0.12.1+1","verifier":"1.0"}}
